{
  "schema": "mcp-recon/v0.1/inventory",
  "scanned_at": "2026-05-01T01:19:18.342Z",
  "server": {
    "name": "mcp-time",
    "version": "1.27.0"
  },
  "tools": [
    {
      "name": "get_current_time",
      "description": "Get current time in a specific timezones",
      "inputSchema": {
        "type": "object",
        "properties": {
          "timezone": {
            "type": "string",
            "description": "IANA timezone name (e.g., 'America/New_York', 'Europe/London'). Use 'Europe/London' as local timezone if no timezone provided by the user."
          }
        },
        "required": [
          "timezone"
        ]
      }
    },
    {
      "name": "convert_time",
      "description": "Convert time between timezones",
      "inputSchema": {
        "type": "object",
        "properties": {
          "source_timezone": {
            "type": "string",
            "description": "Source IANA timezone name (e.g., 'America/New_York', 'Europe/London'). Use 'Europe/London' as local timezone if no source timezone provided by the user."
          },
          "time": {
            "type": "string",
            "description": "Time to convert in 24-hour format (HH:MM)"
          },
          "target_timezone": {
            "type": "string",
            "description": "Target IANA timezone name (e.g., 'Asia/Tokyo', 'America/San_Francisco'). Use 'Europe/London' as local timezone if no target timezone provided by the user."
          }
        },
        "required": [
          "source_timezone",
          "time",
          "target_timezone"
        ]
      }
    }
  ]
}
